id,Artista,Nombre,Album,Año,Genero
3hiuAbARNcPiVeTqvRFeuj,Robert Schumann,"Kinderszenen (Scenes of Childhood), Op. 15: VII. Traumerei (Dreaming)","Schumann, R.: Kinderszenen / Papillons / Carnaval",1993,classical
2TkGYqnVFS0T5u2PYN6JQS,Nils Frahm,Some,Solo,2015,classical
1UQHEsNF9Ow2LI1XCeVI51,Franz Joseph Haydn,"Symphony In D, Hob. I No.6 - ""Le Matin"": 1. Adagio - Allegro",Haydn - Pinnock: Complete Recordings (Collectors Edition),2014,classical
6jY3uqkhNYBfysbyovBKH7,Edgard Varèse,Amériques (1929 Version by Chou Wen-chung),"Dvořák: Symphony No. 9 ""New World"" - Varèse: Amériques (Live)",2015,classical
38iCfXPXqyeEHsNtlxjtSG,Pyotr Ilyich Tchaikovsky,"Tchaikovsky: Swan Lake, Op. 20, Act 2: No. 13 Dances of the Swans - IV. Dance of the Cygnets (Allegro moderato)",Tchaikovsky: Swan Lake,1976,classical
7lcOlVY5Lw7vStpjiKuo6M,Einojuhani Rautavaara,Whispering,In 27 Pieces: the Hilary Hahn Encores,2013,classical
5pg9vSNAOFLtyZpUU42cBo,Richard Addinsell,Warsaw Concerto,Warsaw Concerto - romantic piano classics from the silver screen,1998,classical
3iaolMs6LZvutK4RMNIPi8,George Frideric Handel,Messiah - Part 1: Symphony,Handel: Messiah,1983,classical
0I2kwvXCLolYQ4nZQcF6EQ,Joep Beving,Sleeping Lotus,Solipsism,2015,classical
2GAcOueBAbwU0kgaXKVAdM,Ludwig van Beethoven,"Symphony No.9 in D minor, Op.125 - ""Choral"": 2. Molto vivace",Beethoven: Symphony No.9,2011,classical
23Beog8URdRIIKuN4emwu2,Paul Hindemith,"String Quartet No. 4, Op. 22: II. Schnelle Achtel: Sehr energisch",Crawford / Hindemith / Janacek: String Quartets,2006,classical
5HfVLuge7NXEKY2ErYWsVN,James MacMillan,Oboe Concerto: Oboe Concerto: III. Allegro,Ralph Vaughan Williams & James MacMillan: Oboe Concertos,2015,classical
1lS0u9f4yc2ML1wNNuErQo,Claude Debussy,"Debussy: Suite bergamasque, L. 82: III. Clair de lune",The Very Best of: Leif Ove Andsnes,2011,classical
7cg8S2oryXnrMyMjrqO4Vd,Francis Poulenc,"Napoli, FP 40: II. Nocturne",Poulenc: Piano Music,2014,classical
48RP2cG0QttkE81MyVLlG2,John Adams,Absolute Jest: IV. Meno mosso,Adams: Absolute Jest & Grand Pianola Music,2015,classical
0NQ9NrEQx22mr2CJc2h5J6,Max Richter,Autumn Music 2,Songs From Before,2014,classical
2Auq8PUdLgs8BO2E2CRJsu,Pablo de Sarasate,"Sarasate: Zigeunerweisen, Op. 20",Best of Anne-Sophie Mutter,2008,classical
0rkajHs0Kcw73nFDlKmuBk,Wolfgang Amadeus Mozart,"Piano Sonata No.12 In F, K.332: 2. Adagio",Mozart: Piano Sonatas,2006,classical
1OacCHsUQIAuUtlqv4I0c2,Maurice Ravel,"Tzigane, M. 76 (Version for Violin & Orchestra)",The Essential Itzhak Perlman,1966,classical
7HSs4srn1qnZhh7WRWBVOk,Sergei Prokofiev,"Prokofiev: Romeo and Juliet, Op. 64, Act 1: No. 13, Dance of the Knights (Complete Ballet)",Prokofiev: Romeo and Juliet,1973,classical
6ZrsSJiyETgzmYMrw9tu5G,Richard Wagner,"Tristan und Isolde, WWV 90: Act I: Prelude",Wagner: Tristan und Isolde,2012,classical
7rGmhrepNzP1LJhm1bSRDA,Elinor Frey,Tarantella No. 1,La Voce del Violoncello,2013,classical
6GzMz3s0K1YKwRVI36CgRx,Franz Liszt,"Liebestraume, S541/R211 : No. 3: Nocturne in A-Flat Major",Liszt: Scherzo and March / 3 Liebestraume / Berceuse,1998,classical
28e39ZgF4yqqmRCr8bw8kR,Dario Marianelli,A Tale Of Three Cities,Third Person (Original Motion Picture Soundtrack),2014,classical
2r1FiNXh5mDNEP8K07YRVp,Georges Bizet,"Bizet: Carmen, WD 31, Act 1 Scene 4: No. 5, Havanaise, ""L'amour est un oiseau rebelle"" (Carmen, Chorus)",Bizet: Carmen,1964,classical
5ykXsKJqx0GE0dsogxjylG,Ólafur Arnalds,Near Light,Living Room Songs,2011,classical
5stPdVFNnyEahYLpWs2akd,Léo Delibes,Flower duet from Lakme - Remasterisé en 1987,Classical Chillout,2009,classical
2XSBXz4uDvx1PQPYJWQpcK,George Gershwin,Rhapsody in Blue,Gershwin Plays Gershwin: The Piano Rolls,1993,classical
7cgi6lRggiLAAzsuJOBBeW,Heinrich Isaac,"Innsbruck, ich muß dich lassen",The Book of Madrigals,2006,classical
7xD3YUxCq1yV6K1EXXml8t,Christopher Tye,Miserere mei Deus,Christopher Tye: Latin & English Church Music,2005,classical
70OjkyHJSnoCNtXS4Xz1XB,Anonymous,Sofdu unga astin min (Sweetly Sleeep),Anthology Of Icelandic Choir Music,1993,classical
6PrKZUXJPmBiobMN44yR8Y,Ennio Morricone,The Ecstasy Of Gold,"The Good, The Bad & The Ugly (Original Motion Picture Soundtrack)",1967,classical
4HBMnZFquWVTATSjTABueZ,John Adams,The Chairman Dances (Foxtrot for Orchestra),The Chairman Dances,1987,classical
2TTwSbzdUsJPKioJ868N9D,Hans Zimmer,Solomon,12 Years A Slave (Music From and Inspired by the Motion Picture),2013,classical
1HmZgTVaxF2xRdPaxO7hAf,Fazıl Say,"Symphony No 3, Op. 43 ""Universe"": VI.Dark Matter",Mesopotamia Symphony - Universe Symphony,2013,classical
6vtY2LUeXJ7KISwgiTu0Ph,James Horner,The Ludlows,Legends Of The Fall Original Motion Picture Soundtrack,1995,classical
2Ow0yMUSccQ4vmfq8pyCCF,Olivier Messiaen,Quatuor pour la fin du temps (Quartet for the End of Time) (2008 - Remaster): Louange à l'éternité de Jésus,Messiaen: Quartet for the End of Time; Chronochromie,2008,classical
4IDn6FlDFosueSOH0mfExb,Antonín Dvořák,"Dvorak: Czech Suite, Op. 39, B. 93 : IV. Romanza (Andante con moto)","Dvorak: American Suite, Czech Suite; Overtures and Tone Poems",2006,classical
17i5jLpzndlQhbS4SrTd0B,Johann Sebastian Bach,"Cello Suite No. 1 in G Major, BWV 1007: I. Prélude","Bach: Cello Suites Nos. 1, 5 & 6",1983,classical
4LvswFQIJCZcBOTBiKJ39m,Alessandro Marcello,Oboe Concerto in D Minor: Adagio (Anonimo Veneziano),"Cinema Classics, Vol. 7",1998,classical
1ipJdiNMjgvfAilddGT9sI,Johannes Brahms,Fantasien op. 116: Intermezzo: Adagio,"Linkages - Piano music by Brahms, Wagner, Schönberg a.o.",2012,classical
0AV6qRaNajFNakSCOrXOkT,Gustav Mahler,Symphony No.5 In C Sharp Minor: 4. Adagietto (Sehr langsam),Herbert von Karajan - Adagio,1994,classical
0a9mUPCyu1R2kxRqDoO9Q3,Olivier Messiaen,Preludes: La colombe (The Dove),Messiaen: Preludes / 4 Rhythmic Studies / Canteyodjaya,1999,classical
0QDxP1NMCfKdnLCMY2sOcy,Antonio Vivaldi,"Farnace, RV 711, Act II, Scene V: Aria ""Gelido in ogni vena""",Sinkovsky Plays & Sings Vivaldi,2015,classical
74unAIRMOGUBYZLhIUUztr,Henrik Schwarz,Leave My Head Alone Brain Seven,Henrik Schwarz: Instruments,2015,classical
7hPr0zUTwv36B0zEEaZIXL,Rachel's,Family Portrait,Music for Egon Schiele,1996,classical
1e8K0unvq6bS23MgNhEqnd,Clara Schumann,"Three Romances for Violin & Piano, Op. 22: III. Leidenschaftlich schnell",Schumann: Works for Violon / Viola & Piano,2015,classical
3qmBqj3EmghQ4UayTRBbL1,Arvo Pärt,Da pacem Domine,Arvo Pärt: Da pacem,2006,classical
3pDcfGFaFitzMZZ3xj5HoQ,Percy Grainger,Shepherds Hey,Lincolnshire Posy,2012,classical
2n4qxtA4E5aUz3JPa0ny9o,Einojuhani Rautavaara,"Symphony No. 7, ""Angel of Light"": III. Come un sogno",Mystic Classics - Visionary Choral and Orchestral Masterpieces,2007,classical
6gKtGkDTPjVMsWt02bGCHn,Wolfgang Amadeus Mozart,"Mozart: Piano Concerto No. 23 in A Major, K. 488: I. Allegro",Mozart - Piano Concertos,2003,classical
6FbPeP7zBqDfWUFSotbmUq,Johann Strauss II,Die Fledermaus: Overture,Strauss: Die Fledermaus,1976,classical
79kGOM2eXbPvcpWCGUwKLz,Henry Purcell,"9 Fantasia a 4: V. Fantazia in B-Flat Major, Z. 736",Purcell: Fantazias,1997,classical
1rnI1rsLsAxitG1OkAFkaY,Johann Sebastian Bach,Concerto n°5 en Ré majeur BWV 1050: II. Affettuoso,Bach: Brandenburgische Konzerte,2010,classical
2PHZPYwfvkEDmyhIez05fq,amiina,Perth,The Lighthouse Project,2013,classical
3Cf47MOQsa3ijid90gr5Io,Ólafur Arnalds,Tomorrow's Song,Living Room Songs,2011,classical
4RDQc1lHscLD6i8WjzwpyG,Felix Mendelssohn,"Lieder ohne Worte (Songs without Words), Book 2, Op. 30: No. 7 in E-Flat Major, Op. 30/1",Mendelssohn: Songs Without Words (Selection),1997,classical
64SmfekfWcFnTedsr6kKyy,Igor Stravinsky,The Firebird Suite *: Introduction,Stravinsky: The Firebird / The Rite of Spring,1997,classical
6fvu2d6gHAdiNCMco4lTxK,Maximilian Steinberg,Passion Week: Of Your Mystical Supper,Steinberg: Passion Week,2015,classical
0QhS1nUm7KHdR4fCLWorbR,William Walton,Concerto for Viola & Orchestra: I. Andante comodo,Walton: Viola Concerto / Bruch: Concerto for Violin & Viola,1990,classical
2LhRrWfxTV6ZW1XAOb2OGa,Nico Muhly,Etude No. 3: Etude 3,Nadia Sirota: Baroque,2013,classical
05iURKvut2OWEzPHQUhDT5,George Frideric Handel,"Concerto in D Minor, Op.7, No.4: I. Adagio","Handel: Organ Concertos, Op. 7",2009,classical
6yeqdGVLtsMucpxRZ9Hz6v,Anton Bruckner,"Symphony No. 9 in D Minor, WAB 109: II. Scherzo: Bewegt, lebhaft – Trio: Schnell – Scherzo","Bruckner: Symphony No. 9, Live at the Salzburg Festival",2015,classical
3BO3R8SLyb9cfSCgk1kXUl,Jónsi,Happiness,Riceboy Sleeps,2009,classical
6peXCPlFpyZr2uvEJICXw0,Benjamin Britten,"Piano Concerto, Op.13: 3. Impromptu",Britten & Barber Piano Concertos; Nocturnes,2015,classical
5ztLCIjBElyDk5qXfGRNNP,Sergei Prokofiev,"Prokofiev: Cinderella, Op. 87, Act 3: No. 42, Second Galop (Presto)",Prokofiev: Cinderella,1995,classical
4rFxf3jRHH8YoOEh7opTli,Peter Maxwell Davies,"The Yellow Cake Review, Farewell to Stromness (Excerpt)",LAGQ,1998,classical
2w1UWIyMRcNqbseWaJJ5XX,Igor Stravinsky,The Firebird Suite *: Finale,Stravinsky: The Firebird / The Rite of Spring,1997,classical
77hYBIovOglMHZV6IIo1Mf,Henryk Górecki,"Harpsichord Concerto, Op. 40: 2. Vivace",Time Present And Time Past,2015,classical
2Ua2U7enh9ErAF6DaJh4hg,Max Richter,Only Questions,The Leftovers (Music from the HBO® Series) Season 1,2014,classical
68oxELAW6URbwJCKmBiNDa,Ennio Morricone,"The Ecstasy of Gold (From ""The Good, the Bad and the Ugly"")","The Ecstasy of Gold (From ""The Good, the Bad and the Ugly"") - Single",1966,classical
43kIdtVGy6l5207N9UgHRF,A Winged Victory for the Sullen,Requiem for the Static King Part 1,A Winged Victory for the Sullen,2011,classical
5zO6zyBZd6zqdFBBDZKIds,Tan Dun,"Crouching Tiger, Hidden Dragon","Crouching Tiger, Hidden Dragon (Original Motion Picture Soundtrack)",2000,classical
2CIY2peTbSKNNHgykODpO4,Leopold Stokowski,"Toccata And Fugue In D Minor, BWV 565",Fantasia,1990,classical
2cIUOae4mpQt5PsD8Mqver,Jean Sibelius,"Lemminkainen Suite, Op. 22: II. The Swan of Tuonela",Sibelius: Symphonies Nos. 5 & 6 - The Swan of Tuonela,2012,classical
5XagtNKNl6E0VFn2d355oe,Gustav Holst,"Holst: The Planets, Op. 32: I. Mars, the Bringer of War (Allegro)",Orff: Carmina Burana - Holst: The Planets,1999,classical
2pr6us08iPNzIex5q6fMvI,Clint Mansell,Together We Will Live Forever,The Fountain OST,2006,classical
2GaUVhmY7PKNg9BXeJ9DDr,Claudio Monteverdi,Canzonette d'amore,Monteverdi: Canzonette,1998,classical
4BkaO57Zh4Ra5aMIwrzAeT,Richard Strauss,"Strauss, R: Also sprach Zarathustra, Op. 30 (Opening)",50 Best Film,2010,classical
2pxM1i3B5CpUZNTy8laF3h,John Williams,Bugler's Dream and Olympic Fanfare Medley,John Williams - Greatest Hits 1969-1999,1970,classical
2lx4xGRieHpFgzzqP6ArDP,Arvo Pärt,Cantus in memoriam Benjamin Britten (Cantus in Memory of Benjamin Britten),Stillness: Music of Calm in a Changing World,2010,classical
5PvjR65Uvf6nwBe0Ko9O7z,Giacomo Puccini,"Madam Butterfly (Act II): Un bel di, vedremo (Butterfly)",Puccini: Opera Arias,2009,classical
0abApP5Xl9PVwuE0Vo4Oyz,Frédéric Chopin,"Ballade No. 1 in G minor, Op. 23: Largo - Moderato - Meno mosso - Presto con fuoco",Horowitz: The Historic Return; Carnegie Hall 1965; The 1966 Concerts,1965,classical
1AUiVg8Q8VSgWeA1c14ZWl,Erik Satie,Gnossienne: No. 2,Satie: Avant-dernières pensées (Bonus Track Version),2009,classical
1n8NKQRg8LVHy7oUhUgbFF,John Williams,Hedwig's Theme,Harry Potter and The Sorcerer's Stone Original Motion Picture Soundtrack,2001,classical
4jNQkWhuzqrbqQuqanFFJ6,Maxence Cyrin,Where Is My Mind,Novö Piano,2010,classical
0PlTjNRzj6MkPfaLHNeZLZ,Alexander Borodin,"Polovtsian Dances From ""Prince Igor""","Tchaikovsky: Overture ""1812""; Marche slave / Borodin: In the Steppes; Polovtsian Dances / Rimsky-Korsakov: Russian Easter; Capriccio",1990,classical
50QqEXWsT4M0fP6HnrmgSi,Wolfgang Amadeus Mozart,"Le nozze di Figaro, K. 492, Act I: ""Non più andrai""",50 Best – Mozart,2015,classical
2rPtGpmfYeGQ0S9s3otPH9,Javier Navarrete,Pan's Labyrinth Lullaby,Pan's Labyrinth Extended Edition,2006,classical
0voFtFihGCCN9p1M94CPRd,Carter Burwell,Two Such Souls,Mr. Holmes (Original Motion Picture Soundtrack),2015,classical
6O7Et1ArYoS9nOKwRjK3Oq,Itzhak Perlman,"Main Theme (From ""Schindler's List"")",John Williams - Greatest Hits 1969-1999,1970,classical
4crt0YfhobrACFanvo5ECU,Peter Maxwell Davies,"Symphony No. 10 'Alla ricerca di Borromini', Op. 327: I. Adagio",Sir Peter Maxwell Davies: Symphony No. 10,2014,classical
1my4A3uRDX1AU1xRDiEPni,Richard Wagner,"Rienzi, WWV 49: Overture",Thielemann - My Wagner Album,2013,classical
5YS9gUKBLEOBq0eVZl2klr,Antonín Dvořák,"From the Bohemian Forest, Op. 68, B. 182: No. 5, Silent Woods",Dvorák: Cello Concerto; Silent Woods; Rondo (Remastered),1986,classical
1LWabh9wqLITaRpYe82PoD,Steve Reich,Music for 18 Musicians: Section I,Music for 18 Musicians,1998,classical
37TBjwOpcQIo9IhScN3XhL,Henry Cowell,Ensemble for String Quintet and Thunder Sticks (1956 version): I. Larghetto,Cowell: Music for Strings,2013,classical
7H1WfmD5iXfUmPZA8xKZM2,Ottorino Respighi,Respighi: Pini di Roma: IV. I pini della Via Appia (Tempo di Marcia),Respighi: Pines of Rome; Fountains of Rome,2011,classical
2URjwQulkDiDmFdjSPrcSc,Aaron Copland,Appalachian Spring: VIII. Coda. Moderato,"Copland Conducts Copland - Expanded Edition (Fanfare for the Common Man, Appalachian Spring, Old American Songs (Complete), Rodeo: Four Dance Episodes)",1963,classical
24A3HjyT5sGnrejr7yLDod,Frédéric Chopin,"Nocturne in E-Flat Major, Op. 9, No.2","Chopin: Complete Noctures, Barcarolle, Berceuse",2011,classical
7e8ZbMDwjdbUHWsoMOlZCd,Georges Bizet,Bizet: Carmen: No. 1 Prélude,Bizet : Carmen,2003,classical
3wcoGdd2Ff7wq76TyQfLko,Pierre Boulez,Piano Sonata No.2: 4. Vif,Debussy: 12 Etudes / Boulez: Sonata No.2,2001,classical
6pJZ6ah8d9fQmZJrBB5JPL,William Walton,"Touch Her Soft Lips and Part (From ""Henry V"")",The Essential Itzhak Perlman,1966,classical
1VcGL267AesH4UouorKhsE,Fazıl Say,"Symphony No 2, Op. 38 ""Mesopotamia"": X.Ballad of Mesopotamia",Mesopotamia Symphony - Universe Symphony,2013,classical
7pHdkCXkeC8AYHMcIDzUdf,Gustav Holst,"The Planets, Op. 32: Jupiter, the Bringer of Jollity","Holst: Planets (The) / Elgar: Serenade for String Orchestra, Op. 20",2000,classical
02TadnJNMcVjr4baY39H1p,Johannes Brahms,"Hungarian Dance No.5 In G Minor, WoO 1 No. 5",Brahms: Hungarian Dances,2012,classical
1K2NgS8UaPjRtbGvUYE7Dw,Karol Szymanowski,"Variations on a Polish Theme, Op. 10: No. 5. Andantino",Szymanowski: Complete Piano Works,2015,classical
4yRMcsWVWCYGQPj5am1UCP,John Williams,"Flying Theme (From ""E.T. the Extra-Terrestrial"")",John Williams - Greatest Hits 1969-1999,1970,classical
5dW3suh54vtbllAQgwS249,Rachel Portman,Firing Squad,Private Peaceful (Original Motion Picture Soundtrack),2012,classical
3TPucnH2T71lgcmhsTZVMT,Bohuslav Martinů,"String Quartet No. 6, H. 312: Adagio moderato",Martinu: String Quartets Nos. 3 and 6,2002,classical
3HdhJ7QOAKrvM2aEx4gzv5,Richard Wagner,Der fliegende Hollander: Ouverture,Wagner: Der fliegende Holländer,2015,classical
7BqaOESZ5nhYCScQpKuI5d,Augusta Read Thomas,Incantation,Augusta Read Thomas Music for Strings,2014,classical
489iiJI4OL84YdgrKJPTFd,Francis Poulenc,Sonata for Clarinet and Piano: 1. Allegro tristement - Extract,Yellow Lounge Vol.3,2004,classical
1zWaVBjPgKcFM25rpAAjKc,Sergei Prokofiev,"Piano Concerto No. 3 in C Major, Op. 26: I. Andante - Allegro",Prokofiev & Bartók: Piano Concertos,2013,classical
1QlGhMVQkxVaPx1xn1iytU,Maurice Ravel,Ravel : Daphnis et Chloé : Suite No.2,Ravel : Orchestral works,1992,classical
4zo9nVH8uBk5DnUa92ogWn,Ólafur Arnalds,Þú ert jörðin,...and they have escaped the weight of darkness,2010,classical
2xORus0TIDTVKatLletu1B,Léo Delibes,"The Flower Duet (From ""Lakmé"")",Serenade,2006,classical
5rSR9a0inBSyYlNTLa8BLi,Jean Sibelius,"3 Pièces pour orchestre, Op.96: Valse Lyrique, Op. 96a (version for orchestra)","Sibelius: Pelleas and Melisande Suite, Musik zu einer Szene & 3 Pièces pour orchestre",2015,classical
0kbLBB45YGGWNu3AUL6FIL,Jóhann Jóhannsson,The Theory of Everything,The Theory of Everything (Original Motion Picture Soundtrack),2014,classical
0kd2DKhQH2lEH6esChjd9C,Steve Reich,"Tehillim, Pt. III (Slow)",Phases,2006,classical
6RuLvotrYaws3OMLekBrub,Richard Skelton,Threads Across the River,Landings,2009,classical
65ncpfpqS6d0oF9UaIbvBn,Joep Beving,Wanderlust,Solipsism,2015,classical
7nnjUHV4bxuHVdrADKZber,Antonín Dvořák,"Songs My Mother Taught Me (from ""Gypsy Songs"", Op. 55, No. 4)","Songs My Mother Taught Me (from ""Gypsy Songs"", Op. 55, No. 4)",2015,classical
0sPzBdSWYsp5X9qLyplRVV,Hildur Guðnadóttir,Bær,Saman,2014,classical
7jSQaXLzpLHjSQTev2krvT,Thomas Newman,Nemo Egg (Main Title),Finding Nemo (Original Motion Picture Soundtrack),2003,classical
2jUfzc1laRhp7krOq6zSns,Paul Dukas,L'apprenti sorcier (The Sorcerer's Apprentice),Dukas: Fanfare Pour Preceder La Peri / The Sorcerer’S Apprentice / Chabrier: Suite Pastorale,1990,classical
6Fn1nJXDFywPRM4J6KsTr2,Frédéric Chopin,"Berceuse In D Flat, Op.57",Chopin Gold,2010,classical
7jajXMQrgyZTU9t0YkdRXW,Edgard Varèse,Ionisation,"Varese: Orchestral Works, Vol. 2 - Ameriques / Equatorial / Nocturnal / Ionisation",2008,classical
7nHvS6UUhz2gJhj8TIROLX,Samuel Barber,"Adagio for Strings, Op. 11",Romantic Favorites for Strings (Expanded Edition),1964,classical
5C4e0Zuh6pDyEGFn5ShmBi,Richard Strauss,"Metamorphosen For 23 Solo Strings, TrV 290","Strauss, R.: Tod und Verklärung; Metamorphosen; Four Last Songs",1995,classical
0IbYGw9FH74pBQvj53Xk8l,Dustin O'Halloran,Prologue,Umrika (Original Motion Picture Soundtrack),2015,classical
1qxGvwVUopoFqCeuHzECUB,Antonio Vivaldi,"The 4 Seasons: Violin Concerto In F Minor, Op. 8, No. 4, RV 297, ""L'inverno"" (Winter): II. Largo",Vivaldi: The Four Seasons/Wind Concertos,1995,classical
4sS6WUtvjFWLui3Jj8C6zl,John Williams,Indiana Jones and the Temple of Doom - Raiders of the Lost Ark,"Williams: Film Classics, Vol. 1",2014,classical
1P30rGmTCmtkYzjddyfpss,DJ Spooky,Rebirth of a Nation: A Nation Divided,Rebirth of a Nation,2015,classical
2txF2tgoSqvV4Mxqq0hBri,Johann Pachelbel,"Canon in D, P.37",Yellow Lounge,2001,classical
1qbsaOxbQKRLDTSyS6XcFG,Maurice Ravel,Valses nobles et sentimentales: VIII. Epilogue - Lent,"Alexandre Tharaud. ""Voyage en France""",2011,classical
0ZdliwFyLsOCfD6hPSgoXX,Aaron Copland,4 Dance Episodes from Rodeo: IV. Hoe Down,"Copland Conducts Copland - Expanded Edition (Fanfare for the Common Man, Appalachian Spring, Old American Songs (Complete), Rodeo: Four Dance Episodes)",1963,classical
1lIcdDpGlc2mO2LYA0f5KM,Howard Shore,"The Fellowship Reunited (feat. Sir James Galway, Viggo Mortensen and Renée Fleming)",The Lord Of The Rings - The Return Of The King - The Complete Recordings (Limited Edition),2003,classical
245S8bjhSlQmrdOClFKrdG,Dmitri Shostakovich,"String Quartet No. 1 in C Major, Op. 49: 1. Moderato","Shostakovich: String Quartets Nos. 1, 8 & 14",2015,classical
55xly70WJY1cx5qsoogaqs,John Williams,"Main Title/John Williams/Jaws - From The ""Jaws"" Soundtrack",Jaws (Music From The Original Motion Picture Soundtrack),1975,classical
2yJVk6jfa2xAEqVb2qDFgn,Ralph Vaughan Williams,Fantasia on a Theme by Thomas Tallis,Romantic Favorites for Strings (Expanded Edition),1964,classical
4fM3elAWY0M2fDVW6rg9IQ,Giuseppe Verdi,La forza del destino: Overture (Sinfonia),Verdi: Overtures & Preludes,1997,classical
7fjCjhCZdR0gSPVyv3DluQ,Arvo Pärt,Tabula Rasa: I. Ludus,Arvo Pärt: Portrait,2010,classical
3y9uQIatvsOg3tI8mPK8u4,Franz Joseph Haydn,"String Quartet in D Major, Op. 64/5: Adagio cantabile",Haydn (The Best Of),1997,classical
67F2FBLJL9Wn09qvPe6XVa,Modest Mussorgsky,Night on Bare Mountain,"Mussorgsky Pictures at an Exhibition, Songs and Dances of Death, Night on Bare Mountain",2015,classical
2cl3STzwTmCH93choV3TCl,John Luther Adams,In The White Silence: Letter B,John Luther Adams: In the White Silence,2003,classical
614GvG7YckXnPC9nCVeN0P,Henry Purcell,"Come Ye Sons of Art, Z.323: III. Sound the Trumpet - Trumpet, trombone, baroque guitar, cello and organ",Tintomara,2015,classical
70nMUxP46mAcjW5iRpRiyN,Frederick Delius,Romance for Cello and Piano,Romance for Cello and Piano,2015,classical
4GTuTtluEfLEJ7Y2p5FzjW,Ludwig van Beethoven,"Quartet VIII No.2 In E minor, Op.59: III. Allegretto","Beethoven: ""Razumovsky"" Quartets VII, VIII & IX (Op. 59, Nos. 1-3)",2006,classical
6515L0Iaaah4YZUJubjfPS,Felix Mendelssohn,"Piano Concerto No. 2 in D Minor, Op. 40, MWV O11: Adagio (A Midsummer Night's Sex Comedy)","Cinema Classics, Vol. 8",1998,classical
3UlRuZWQGw5mfSJFm2jRDT,Henry Cowell,The Banshee,Cowell: Homage To Iran / Piano Pieces / Set of Five / Six Casual Developments / Two Songs,2005,classical
55wZi8kAOHttzy927WdDeE,Dustin O'Halloran,A Voyage Begins,Umrika (Original Motion Picture Soundtrack),2015,classical
2mYuazFCuAeDsU2EkY68Bp,Ralph Vaughan Williams,Vaughan Williams: The Lark Ascending: Opening (Excerpt),Classical Chillout,2009,classical
6i8DgNw7IZAqw8jjtHWN44,Karol Szymanowski,"Violin Sonata in D Minor, Op. 9: II. Andantino tranquillo e dolce",Szymanowski: Violin Sonata / Mythes / Notturne and Tarantella,2007,classical
3hO3haFBsrcCzIFd6HJXnj,Frédéric Chopin,"24 Preludes, Op. 28: Prelude No. 4 in E Minor","Chopin: 24 Preludes; Sonata No.2, Op.35; Polonaise, Op.53",1999,classical
39ixK8F8e3D18AYEXtIYFZ,Ingrid Kertesi,"Ellen's Gesang III (Ave Maria!), Op. 56, No. 6, D. 839, ""Hymne An Die Jungfrau""",Ave Maria (Sacred Arias And Choruses),1997,classical
67l1U6nKf6zgwCV3AhObFa,Roger Eno,An Excursion,In a Room,1993,classical
0AoZvVKE5TXYf81MQcn4S6,Iannis Xenakis,Herma,Xenakis: Piano Works,2015,classical
1bzFjrI7CYXDcyEYY2iT7M,Alexander Scriabin,"Piano Concerto in F-Sharp Minor, Op. 20: I. Allegro",Scriabin: Piano Concerto / Prometheus,1999,classical
4E1Rquqd8ZAnOy3BYK0K1Z,Franz Liszt,Un sospiro,My Favorite Liszt,2000,classical
2SvULYdmPes23yZQYeLkXV,Johannes Brahms,"21 Hungarian Dances, WoO 1 (version for orchestra): Hungarian Dance No. 5 (orch. Schmeling)",Brahms: Hungarian Dances Nos. 1-21,1988,classical
5nsYZFNyMefd50yamWgMfy,Edward Elgar,"Pomp and Circumstance, Op. 39: No. 1, March in D Major",The 50 Greatest Pieces of Classical Music,2009,classical
0V4rUX2i5m3TaFrDDywRXS,Carter Burwell,Mr. Holmes,Mr. Holmes (Original Motion Picture Soundtrack),2015,classical
16Da4KMuL78KtBdKUYMQYF,Olivier Messiaen,Des canyons aux etoiles …: I. Le desert,Messiaen: Des canyons aux étoiles (Live),2015,classical
4sm3tGqlJ0qMIUse4syKRI,Jules Massenet,Elegie: O doux printemps d'autrefois,Romance of the Violin,2003,classical
1nmeX39rjGxyaoSkPxSHwr,Johann Sebastian Bach,"The Well-Tempered Clavier, Book 2, BWV 870-893: Prelude No. 2 in C Minor, BWV 871","Bach, J.S.: Well-Tempered Clavier (The), Book 2",2009,classical
0itndpPjxQrWj1mDENoKmG,Thomas Newman,The Green Mile,The Green Mile (Original Motion Picture Soundtrack),1999,classical
6gz6rxRge7BLRreM9uJXxI,Arnold Schoenberg,"Schoenberg: Verklärte Nacht, Op. 4: I. Grave","Schonberg : Verklärte Nacht, 5 Orchestral Pieces & Piano Works",1995,classical
1VVWruroBOclbhev74ipRG,Claude Debussy,Prélude à l'après-midi d'un faune - 1986 Remastered Version,Debussy: La mer; Images for Orchestra; Trois Nocturnes; Jeux etc,2011,classical
00isAURAZeKQXv6CW2vckb,Gottfried Heinrich Stölzel,"Diomedes: Anna Magdalena Notenbuch (Clavier-Buchlein III): Bist du bei mir, BWV 508 (attrib. G.H. Stolzel)",Divine Redeemer,2015,classical
4XFnHO9oybBaU0h9PgDM3C,Henrik Schwarz,Cloud Three,Henrik Schwarz: Instruments,2015,classical
5grzlt83cKal2JPOiGeeuv,Frederick Delius,Brigg Fair,Pops Britannia,1989,classical
28Kit53CTen2YShfgKHpC6,Gustav Mahler,"Symphony No.6 In A Minor: 2. (3.) Andante moderato - Live From Philharmonie, Berlin / 2004",Gustav Mahler Edition,2010,classical
1Rb2tPT1l1rU9KtvLHy30E,Claudio Monteverdi,Vespers of 1610: Deus in adiutorium meum intende,Monteverdi: Vespers of 1610,2014,classical
2gDPe8PE5re1hcxHGxMz7A,Michael Praetorius,Terpsichore*: a. Bransle Gay 1 b. Bransle de Montirande,Praetorius: Dances From Terpsichore,1998,classical
2UEer5v08SeaipCQuO4QNb,Franz Schubert,"Piano Sonata No.20 In A Major, D.959: 4. Rondo (Allegretto)",Schubert: Piano Sonatas in A major; A minor; E major,1991,classical
6UIn6aFGQYeP2gNAlzSxDg,Balmorhea,Constellations,Constellations,2010,classical
47oK8fKXXVGsFttsaaUrnu,Modest Mussorgsky,Pictures At An Exhibition: The Great Gate Of Kiev,Mussorgsky: Pictures at an Exhibition,2009,classical
1FHpgVtsaDeASGQyehjlzS,Franz Schubert,"Valse sentimentale No. 13, D. 779, Op. 50",Schubert: Des fragments aux étoiles,2015,classical
7oQ3nJCQKM5KMYIi96vAMr,Claudio Prieto,Fandango (Recreación Libre Del Fandango de Soler),Claudio Prieto: Compositores Contemporáneos. 13 Ciclo de Música Contemporánea de Málaga,2006,classical
2dVMQ0MWkOspUA2pLNaag2,Jóhann Jóhannsson,The Candlelight Vigil,Prisoners (Original Motion Picture Soundtrack),2013,classical
2ED1VZ53iRImo252U2PEsu,Gregorio Allegri,Miserere,Allegri Miserere,2006,classical
0T02WlrUAK45ApAVVixmcc,Giacomo Puccini,"La Bohème / Act 1: ""Che gelida manina""",The Age Of Puccini,2015,classical
31loMj4ZFxOedEd2bHHQjg,James Horner,Legends of the Fall,Legends Of The Fall Original Motion Picture Soundtrack,1995,classical
1XIOHToglHMmtXXs1wZLiG,John Luther Adams,Canticles of the Sky: Sky with Four Suns,The Wind in High Places,2015,classical
2r2hR9gGMdusndlRzhM0cc,Percy Grainger,Colonial Song,Percy Grainger: The Power Of Love,1998,classical
2zOGUiRStjCJLbvc7slMLR,Gustav Holst,First Suite in E-flat: Chaconne - (1909),Composer's Collection: Gustav Holst,2006,classical
5NinL2jNwjeRpHwTFeRSv9,Claudio Monteverdi,"Monteverdi: L'incoronazione di Poppea, SV 308, Act 3: ""Pur ti miro"" (Neron, Popea)",Monteverdi: Teatro d'amore,2009,classical
