id;nombre;marca;presentacion;nombre_1;nombre_2;nombre_3;ClasificaciÛn
7,79E+12;Acondicionador Blindaje Platinum Tresemme 400 Ml;TRESEMM…;400.0 ml;Acondicionador;Acondicionador   Blindaje;Acondicionador   Blindaje   Platinum;Perfumer√≠a e higiene personal
7,79E+12;Acondicionador Sedal Bomba de Nutricion 340 Ml;SEDAL;340.0 ml;Acondicionador;Acondicionador   Sedal;Acondicionador   Sedal   Bomba;Perfumer√≠a e higiene personal
7,79E+12;Queso Crema Untable Casancrem Clasico 500 Gr;CASANCREM;500.0 gr;Queso;Queso   Crema;Queso   Crema   Untable;L√°cteos y derivados
7,79E+12;Queso Crema Untable Casancrem Light 500 Gr;CASANCREM;500.0 gr;Queso;Queso   Crema;Queso   Crema   Untable;L√°cteos y derivados
7,79E+12;Queso Crema Untable Casancrem Light 300 Gr;CASANCREM;300.0 gr;Queso;Queso   Crema;Queso   Crema   Untable;L√°cteos y derivados
7,79E+12;Flan Vainilla con Caramelo Danette en Pack 2 Un 190 Gr;DANETTE;190.0 gr;Flan;Flan   Vainilla;Flan   Vainilla   con;Almacen no incluidos en otra categor√≠a
7,79E+12;Yogur Vainilla Danonino Pack 2 Un 161 Gr;DANONINO;161.0 gr;Yogur;Yogur   Vainilla;Yogur   Vainilla   Danonino;L√°cteos y derivados
7,79E+12;Yogur Frutilla Danonino Pack 2 Un 161 Gr;DANONINO;161.0 gr;Yogur;Yogur   Frutilla;Yogur   Frutilla   Danonino;L√°cteos y derivados
7,79E+12;Yogur Descremado con Colchon de Frutas Arandano Granada Ser 175 Gr;SER;175.0 gr;Yogur;Yogur   Descremado;Yogur   Descremado   con;L√°cteos y derivados
7,79E+12;Queso Crema Untable Clasico Casancrem 300 Gr;CASANCREM;300.0 gr;Queso;Queso   Crema;Queso   Crema   Untable;L√°cteos y derivados
7,79E+12;Postre Dulce de Leche Ser Pack 2 Un 220 Gr;SER;220.0 gr;Postre;Postre   Dulce;Postre   Dulce   de;Almacen no incluidos en otra categor√≠a
7,79E+12;Postre Vainilla con Rocklets Serenito 120 Gr;SERENITO;120.0 gr;Postre;Postre   Vainilla;Postre   Vainilla   con;Almacen no incluidos en otra categor√≠a
7,79E+12;Postre Vainilla con Bombas Crocantes Serenito 118 Gr;SERENITO;118.0 gr;Postre;Postre   Vainilla;Postre   Vainilla   con;Almacen no incluidos en otra categor√≠a
7,79E+12;Postre Crema Americana Danette Pack 2 Un 190 Gr;DANETTE;190.0 gr;Postre;Postre   Crema;Postre   Crema   Americana;Almacen no incluidos en otra categor√≠a
7,79E+12;Yogur Bebible Entero Vainilla Botella Yogurisimo 185 Gr;YOGURÕSIMO;185.0 gr;Yogur;Yogur   Bebible;Yogur   Bebible   Entero;L√°cteos y derivados
7,79E+12;Yogur Bebible Entero Frutilla Yogurisimo 185 Gr;YOGURÕSIMO;185.0 gr;Yogur;Yogur   Bebible;Yogur   Bebible   Entero;L√°cteos y derivados
7,79E+12;Yogur Entero Firme Vainilla Yogurisimo 190 Gr;YOGURÕSIMO;190.0 gr;Yogur;Yogur   Entero;Yogur   Entero   Firme;L√°cteos y derivados
7,79E+12;Postre Chocolate con Crema La Copa Serenito 100 Gr;SERENITO;100.0 gr;Postre;Postre   Chocolate;Postre   Chocolate   con;Almacen no incluidos en otra categor√≠a
7,79E+12;Yogur Entero Cereales Yogurisimo 166 Gr;YOGURÕSIMO;166.0 gr;Yogur;Yogur   Entero;Yogur   Entero   Cereales;L√°cteos y derivados
7,79E+12;Yogur Bebible Entero Vainilla Yogurisimo 1.3 Kg;YOGURÕSIMO;1.3 kg;Yogur;Yogur   Bebible;Yogur   Bebible   Entero;L√°cteos y derivados
7,79E+12;Yogur Bebible Entero Frutilla Yogurisimo 1.3 Kg;YOGURÕSIMO;1.3 kg;Yogur;Yogur   Bebible;Yogur   Bebible   Entero;L√°cteos y derivados
7,79E+12;Yogur Bebible Vainilla Danonino 185 Gr;DANONINO;185.0 gr;Yogur;Yogur   Bebible;Yogur   Bebible   Vainilla;L√°cteos y derivados
7,79E+12;Yogur Bebible Frutilla Danonino 185 Gr;DANONINO;185.0 gr;Yogur;Yogur   Bebible;Yogur   Bebible   Frutilla;L√°cteos y derivados
7,79E+12;Yogur Entero Firme Frutilla Yogurisimo 190 Gr;YOGURÕSIMO;190.0 gr;Yogur;Yogur   Entero;Yogur   Entero   Firme;L√°cteos y derivados
7,79E+12;Flan Vainilla Fortificado Serenito en Pack 2 Un 210 Gr;SERENITO;210.0 gr;Flan;Flan   Vainilla;Flan   Vainilla   Fortificado;Almacen no incluidos en otra categor√≠a
7,79E+12;Yogur Descremado Firme Vainilla Ser 195 Gr;SER;195.0 gr;Yogur;Yogur   Descremado;Yogur   Descremado   Firme;L√°cteos y derivados
7,79E+12;Yogur Descremado Firme Frutilla Ser 195 Gr;SER;195.0 gr;Yogur;Yogur   Descremado;Yogur   Descremado   Firme;L√°cteos y derivados
7,79E+12;Flan Vainilla Ser en Pack 2 Un 95 Gr;SER;190.0 gr;Flan;Flan   Vainilla;Flan   Vainilla   Ser;Almacen no incluidos en otra categor√≠a
7,79E+12;Postre Chocolate Ser Pack 2 Un 100 Gr;SER;200.0 gr;Postre;Postre   Chocolate;Postre   Chocolate   Ser;Almacen no incluidos en otra categor√≠a
7,79E+12;Yogur Bebible Descremado Multifruta Ser 185 Gr;SER;185.0 gr;Yogur;Yogur   Bebible;Yogur   Bebible   Descremado;L√°cteos y derivados
7,79E+12;Alimento Lacteo Bebible Frutilla Actimel 6 Un 100 Gr;ACTIMEL;600.0 gr;Alimento;Alimento   Lacteo;Alimento   Lacteo   Bebible;L√°cteos y derivados
7,79E+12;Yogur Bebible Vainilla Tetra Yogurisimo 1 Kg;YOGURÕSIMO;1.0 kg;Yogur;Yogur   Bebible;Yogur   Bebible   Vainilla;L√°cteos y derivados
7,79E+12;Yogur Bebible Entero Frutilla Yogurisimo 1 Lt;YOGURÕSIMO;1.0 lt;Yogur;Yogur   Bebible;Yogur   Bebible   Entero;L√°cteos y derivados
7,79E+12;Yogur Descremado Batido Calcio Frutilla Vitamina Ser Pack 2 Un 120 Gr;SER;240.0 gr;Yogur;Yogur   Descremado;Yogur   Descremado   Batido;L√°cteos y derivados
7,79E+12;Yogur Descremado Batido Durazno Calcio Ser Pack 2 Un 120 Gr;SER;240.0 gr;Yogur;Yogur   Descremado;Yogur   Descremado   Batido;L√°cteos y derivados
7,79E+12;Leche Chocolatada Cindor 1 Lt;CINDOR;1.0 lt;Leche;Leche   Chocolatada;Leche   Chocolatada   Cindor;L√°cteos y derivados
7,79E+12;Yogur Bebible Vainilla Tetra Ser 1 Kg;SER;1.0 kg;Yogur;Yogur   Bebible;Yogur   Bebible   Vainilla;L√°cteos y derivados
7,79E+12;Yogur Descremado con Cereales y Miel Ser 165 Gr;SER;165.0 gr;Yogur;Yogur   Descremado;Yogur   Descremado   con;L√°cteos y derivados
7,79E+12;Vino Tinto Hereford 750 Ml;HEREFORD;750.0 ml;Vino;Vino   Tinto;Vino   Tinto   Hereford;"Bebidas alcoh√≥licas (no bebidas ""blancas"")"
7,79E+12;Vino Blanco Hereford 750 Ml;HEREFORD;750.0 ml;Vino;Vino   Blanco;Vino   Blanco   Hereford;"Bebidas alcoh√≥licas (no bebidas ""blancas"")"
7,79E+12;Vino Espumante Blue Evolution Frizze 750 Ml;FRIZEE;750.0 ml;Vino;Vino   Espumante;Vino   Espumante   Blue;"Bebidas alcoh√≥licas (no bebidas ""blancas"")"
7,79E+12;Vino Tinto Vainilla 1 Dada 750 Cc;DADA;750.0 cc;Vino;Vino   Tinto;Vino   Tinto   Vainilla;"Bebidas alcoh√≥licas (no bebidas ""blancas"")"
7,79E+12;Vino Tinto Dada 3 Finca Las Moras 750 Ml;FINCA LAS MORAS;750.0 ml;Vino;Vino   Tinto;Vino   Tinto   Dada;"Bebidas alcoh√≥licas (no bebidas ""blancas"")"
7,79E+12;Vino Espumante Blanco Frizze Classic 750 Ml;FRIZEE;750.0 ml;Vino;Vino   Espumante;Vino   Espumante   Blanco;"Bebidas alcoh√≥licas (no bebidas ""blancas"")"
7,79E+12;Vino Tinto Varietal Termidor 1 Lt;TERMIDOR;1.0 lt;Vino;Vino   Tinto;Vino   Tinto   Varietal;"Bebidas alcoh√≥licas (no bebidas ""blancas"")"
7,79E+12;Vino Tinto Cabernet Dada Art 750 Cc;DADA;750.0 cc;Vino;Vino   Tinto;Vino   Tinto   Cabernet;"Bebidas alcoh√≥licas (no bebidas ""blancas"")"
7,79E+12;Vino Tinto Malbec Dada Art 750 Cc;DADA;750.0 cc;Vino;Vino   Tinto;Vino   Tinto   Malbec;"Bebidas alcoh√≥licas (no bebidas ""blancas"")"
7,79E+12;Vodka Hiram Walker 1 Lt;HIRAM WALKER;1.0 lt;Vodka;Vodka   Hiram;Vodka   Hiram   Walker;"Bebidas ""blancas"""
7,79E+12;Margarina Clasica Danica 200 Gr;D¡NICA;200.0 gr;Margarina;Margarina   Clasica;Margarina   Clasica   Danica;Almacen no incluidos en otra categor√≠a
7,79E+12;Aceitunas Verdes Clasicas Doypack Castell 180 Gr;CASTELL;180.0 gr;Aceitunas;Aceitunas   Verdes;Aceitunas   Verdes   Clasicas;Almacen no incluidos en otra categor√≠a
7,79E+12;Aceitunas Verdes Descarozadas en Doypack Castell 150 Gr;CASTELL;150.0 gr;Aceitunas;Aceitunas   Verdes;Aceitunas   Verdes   Descarozadas;Almacen no incluidos en otra categor√≠a
7,79E+12;Aceitunas Verdes Rellenas en Doy Pack Castell 180 Gr;CASTELL;180.0 gr;Aceitunas;Aceitunas   Verdes;Aceitunas   Verdes   Rellenas;Almacen no incluidos en otra categor√≠a
7,79E+12;Aceitunas Verdes Clasicas Doy Pack Castell 100 Gr;CASTELL;100.0 gr;Aceitunas;Aceitunas   Verdes;Aceitunas   Verdes   Clasicas;Almacen no incluidos en otra categor√≠a
7,79E+12;Vino Blanco Chenin Dulce Natural Santa Julia 750 Ml;SANTA JULIA;750.0 ml;Vino;Vino   Blanco;Vino   Blanco   Chenin;"Bebidas alcoh√≥licas (no bebidas ""blancas"")"
7,79E+12;Vino Tinto Malbec Santa Julia 750 Cc;SANTA JULIA;750.0 cc;Vino;Vino   Tinto;Vino   Tinto   Malbec;"Bebidas alcoh√≥licas (no bebidas ""blancas"")"
7,79E+12;Gaseosa Pepsi 500 Cc;PEPSI;500.0 cc;Gaseosa;Gaseosa   Pepsi;Gaseosa   Pepsi   500;Bebidas sin alcohol (no agua)
7,79E+12;Gaseosa Pepsi 1.5 Lt;PEPSI;1.5 lt;Gaseosa;Gaseosa   Pepsi;Gaseosa   Pepsi   1.5;Bebidas sin alcohol (no agua)
7,79E+12;Gaseosa Cola Pepsi Light 1.5 Lt;PEPSI;1.5 lt;Gaseosa;Gaseosa   Cola;Gaseosa   Cola   Pepsi;Bebidas sin alcohol (no agua)
7,79E+12;Gaseosa Pomelo Light Paso de los Toros 1.5 Lt;PASO DE LOS TOROS;1.5 lt;Gaseosa;Gaseosa   Pomelo;Gaseosa   Pomelo   Light;Bebidas sin alcohol (no agua)
7,79E+12;Gaseosa Lima Limon 7 Up 1.5 Lt;7 UP;1.5 lt;Gaseosa;Gaseosa   Lima;Gaseosa   Lima   Limon;Bebidas sin alcohol (no agua)
7,79E+12;Agua Saborizada Citrus con Gas H2Oh! 1.5 Lt;H2OH!;1.5 lt;Agua;Agua   Saborizada;Agua   Saborizada   Citrus;Bebidas sin alcohol (no agua)
7,79E+12;Agua Saborizada Limoneto con Gas H2Oh! 1.5 Lt;H2OH!;1.5 lt;Agua;Agua   Saborizada;Agua   Saborizada   Limoneto;Bebidas sin alcohol (no agua)
7,79E+12;Gaseosa Pepsi 2.25 Lt;PEPSI;2.25 lt;Gaseosa;Gaseosa   Pepsi;Gaseosa   Pepsi   2.25;Bebidas sin alcohol (no agua)
7,79E+12;Gaseosa Pepsi Light 2.25 Lt;PEPSI;2.25 lt;Gaseosa;Gaseosa   Pepsi;Gaseosa   Pepsi   Light;Bebidas sin alcohol (no agua)
7,79E+12;Gaseosa Lima Limon 7 Up 2.25 Lt;7 UP;2.25 lt;Gaseosa;Gaseosa   Lima;Gaseosa   Lima   Limon;Bebidas sin alcohol (no agua)
7,79E+12;Agua Saborizada Citrus con Gas H2Oh! 2.25 Lt;H2OH!;2.25 lt;Agua;Agua   Saborizada;Agua   Saborizada   Citrus;Bebidas sin alcohol (no agua)
7,79E+12;Ketchup Natura 250 Gr;NATURA;250.0 gr;Ketchup;Ketchup   Natura;Ketchup   Natura   250;Almacen no incluidos en otra categor√≠a
7,79E+12;Mayonesa Doypack Natura 237 Gr;NATURA;237.0 gr;Mayonesa;Mayonesa   Doypack;Mayonesa   Doypack   Natura;Almacen no incluidos en otra categor√≠a
7,79E+12;Mayonesa Doypack Natura 950 Gr;NATURA;950.0 gr;Mayonesa;Mayonesa   Doypack;Mayonesa   Doypack   Natura;Almacen no incluidos en otra categor√≠a
7,79E+12;Mayonesa Doypack Natura 500 Ml;NATURA;500.0 ml;Mayonesa;Mayonesa   Doypack;Mayonesa   Doypack   Natura;Almacen no incluidos en otra categor√≠a
7,79E+12;Mayonesa con Aceite de Oliva Mayoliva 227 Gr;MAYOLIVA;237.0 gr;Mayonesa;Mayonesa   con;Mayonesa   con   Aceite;Almacen no incluidos en otra categor√≠a
7,79E+12;Mostaza Doypack Natura 250 Gr;NATURA;250.0 gr;Mostaza;Mostaza   Doypack;Mostaza   Doypack   Natura;Almacen no incluidos en otra categor√≠a
7,79E+12;Desodorante Antitranspirante en Aerosol Nivea Silver Sensitive 150 Cc;NIVEA;150.0 cc;Desodorante;Desodorante   Antitranspirante;Desodorante   Antitranspirante   en;Perfumer√≠a e higiene personal
7,79E+12;Aceitunas Verdes Descarozadas en Salmuera Nucete 190 Gr;NUCETE;190.0 gr;Aceitunas;Aceitunas   Verdes;Aceitunas   Verdes   Descarozadas;Almacen no incluidos en otra categor√≠a
7,79E+12;Aceitunas Verdes Descarozadas en Salmuera Nucete 150 Gr;NUCETE;150.0 gr;Aceitunas;Aceitunas   Verdes;Aceitunas   Verdes   Descarozadas;Almacen no incluidos en otra categor√≠a
7,79E+12;Aceitunas Verdes Rellenas con Morron en Salmuera Nucete 300 Gr;NUCETE;300.0 gr;Aceitunas;Aceitunas   Verdes;Aceitunas   Verdes   Rellenas;Almacen no incluidos en otra categor√≠a
7,79E+12;Cuadritos de Avena Quaker 300 Gr;QUAKER;300.0 gr;Cuadritos;Cuadritos   de;Cuadritos   de   Avena;Almacen no incluidos en otra categor√≠a
7,79E+12;Polenta Instantanea Magica Quaker 500 Gr;QUAKER;500.0 gr;Polenta;Polenta   Instantanea;Polenta   Instantanea   Magica;Almacen no incluidos en otra categor√≠a
7,79E+12;Bebida Isotonica Manzana Gatorade 500 Ml;GATORADE;500.0 ml;Bebida;Bebida   Isotonica;Bebida   Isotonica   Manzana;Bebidas sin alcohol (no agua)
7,79E+12;Bebida Isotonica Naranja Gatorade 500 Ml;GATORADE;500.0 ml;Bebida;Bebida   Isotonica;Bebida   Isotonica   Naranja;Bebidas sin alcohol (no agua)
7,79E+12;Bebida Isotonica Cool Blue Gatorade 500 Ml;GATORADE;500.0 ml;Bebida;Bebida   Isotonica;Bebida   Isotonica   Cool;Bebidas sin alcohol (no agua)
7,79E+12;Bebida Isotonica Manzana Gatorade 750 Cc;GATORADE;750.0 cc;Bebida;Bebida   Isotonica;Bebida   Isotonica   Manzana;Bebidas sin alcohol (no agua)
7,79E+12;Cuadritos de Avena Rellenos con Miel y Nuez Quaker 200 Gr;QUAKER;200.0 gr;Cuadritos;Cuadritos   de;Cuadritos   de   Avena;Almacen no incluidos en otra categor√≠a
7,79E+12;Bebida Isotonica Naranja Gatorade 1.25 Lt;GATORADE;1.25 lt;Bebida;Bebida   Isotonica;Bebida   Isotonica   Naranja;Bebidas sin alcohol (no agua)
7,79E+12;Bebida Isotonica Manzana Gatorade 1.25 Lt;GATORADE;1.25 lt;Bebida;Bebida   Isotonica;Bebida   Isotonica   Manzana;Bebidas sin alcohol (no agua)
7,79E+12;Bebida Isotonica Cool Blue Gatorade 1.25 Lt;GATORADE;1.25 lt;Bebida;Bebida   Isotonica;Bebida   Isotonica   Cool;Bebidas sin alcohol (no agua)
7,79E+12;Harina de Trigo 000 Can~uelas 1 Kg;CA—UELAS;1.0 kg;Harina;Harina   de;Harina   de   Trigo;Almacen no incluidos en otra categor√≠a
7,79E+12;Aceite de Girasol Can~uelas 900 Cc;CA—UELAS;900.0 cc;Aceite;Aceite   de;Aceite   de   Girasol;Almacen no incluidos en otra categor√≠a
7,79E+12;Aceite de Girasol Can~uelas 1.5 Lt;CA—UELAS;1.5 lt;Aceite;Aceite   de;Aceite   de   Girasol;Almacen no incluidos en otra categor√≠a
7,79E+12;Harina con Levadura Pizza Pureza 1 Kg;PUREZA;1.0 kg;Harina;Harina   con;Harina   con   Levadura;Almacen no incluidos en otra categor√≠a
7,79E+12;Harina de Trigo 0000 Ultra Refinada Pureza 1 Kg;PUREZA;1.0 kg;Harina;Harina   de;Harina   de   Trigo;Almacen no incluidos en otra categor√≠a
7,79E+12;Harina Leudante Ultrarefinada Pureza 1 Kg;PUREZA;1.0 kg;Harina;Harina   Leudante;Harina   Leudante   Ultrarefinada;Almacen no incluidos en otra categor√≠a
7,79E+12;Harina con Levadura para Pan Casero Pureza 1 Kg;PUREZA;1.0 kg;Harina;Harina   con;Harina   con   Levadura;Almacen no incluidos en otra categor√≠a
7,79E+12;Premezcla para Pizza con Levadura Pureza 550 Gr;PUREZA;550.0 gr;Premezcla;Premezcla   para;Premezcla   para   Pizza;Almacen no incluidos en otra categor√≠a
7,79E+12;Bizcochitos Agridulces 9 de Oro 200 Gr;9 DE ORO;200.0 gr;Bizcochitos;Bizcochitos   Agridulces;Bizcochitos   Agridulces   9;Panificados, pastas y arroz
7,79E+12;Bizcochitos Clasicas 9 de Oro 200 Gr;9 DE ORO;200.0 gr;Bizcochitos;Bizcochitos   Clasicas;Bizcochitos   Clasicas   9;Panificados, pastas y arroz
7,79E+12;Bizcochos Azucarados 9 de Oro 210 Gr;9 DE ORO;210.0 gr;Bizcochos;Bizcochos   Azucarados;Bizcochos   Azucarados   9;Panificados, pastas y arroz
7,79E+12;Bizcochitos Light 9 de Oro 170 Gr;9 DE ORO;170.0 gr;Bizcochitos;Bizcochitos   Light;Bizcochitos   Light   9;Panificados, pastas y arroz
7,79E+12;Galletitas Sconcitos 9 de Oro 200 Gr;9 DE ORO;200.0 gr;Galletitas;Galletitas   Sconcitos;Galletitas   Sconcitos   9;Panificados, pastas y arroz
7,79E+12;Te Amarillo en Saquitos Ensobrados Cachamai 20 Un;CACHAMAI;20.0 un;Te;Te   Amarillo;Te   Amarillo   en;Almacen no incluidos en otra categor√≠a
7,79E+12;Vino Tinto Cosecha Tardia Bodega Norton 750 Cc;NORTON;750.0 cc;Vino;Vino   Tinto;Vino   Tinto   Cosecha;"Bebidas alcoh√≥licas (no bebidas ""blancas"")"
7,79E+12;Vino Rosado Cosecha Tardia Norton 750 Cc;NORTON;750.0 cc;Vino;Vino   Rosado;Vino   Rosado   Cosecha;"Bebidas alcoh√≥licas (no bebidas ""blancas"")"
7,79E+12;Vino Cosecha Tardia Norton 750 Ml;NORTON;750.0 ml;Vino;Vino   Cosecha;Vino   Cosecha   Tardia;"Bebidas alcoh√≥licas (no bebidas ""blancas"")"
7,79E+12;Vino Tinto Clasico Bodega Norton 750 Cc;NORTON;750.0 cc;Vino;Vino   Tinto;Vino   Tinto   Clasico;"Bebidas alcoh√≥licas (no bebidas ""blancas"")"
7,79E+12;Cafe en Saquitos Bonafide Sensaciones 100 Gr;BONAFIDE;100.0 gr;Cafe;Cafe   en;Cafe   en   Saquitos;Caf√©, te e infuciones
7,79E+12;Capellettis Relleno Carne con Vitamina E Giacomo Capelettini 500 Gr;GIACOMO;500.0 gr;Capellettis;Capellettis   Relleno;Capellettis   Relleno   Carne;Panificados, pastas y arroz
7,79E+12;Capellettis Relleno Verdura con Vitamina E Giacomo Capelettini 500 Gr;GIACOMO;500.0 gr;Capellettis;Capellettis   Relleno;Capellettis   Relleno   Verdura;Panificados, pastas y arroz
7,79E+12;Capellettis Tridicci con Vitaminia E Giacomo Capelettini 500 Gr;GIACOMO;500.0 gr;Capellettis;Capellettis   Tridicci;Capellettis   Tridicci   con;Panificados, pastas y arroz
7,79E+12;Licor de Huevo Cusenier 700 Cc;CUSENIER;700.0 cc;Licor;Licor   de;Licor   de   Huevo;"Bebidas ""blancas"""
7,79E+12;Licor de Chocolate Cusenier 700 Cc;CUSENIER;700.0 cc;Licor;Licor   de;Licor   de   Chocolate;"Bebidas ""blancas"""
7,79E+12;Licor de Cafe al Cognac Cusenier 700 Cc;CUSENIER;700.0 cc;Licor;Licor   de;Licor   de   Cafe;"Bebidas ""blancas"""
7,79E+12;Aperitivo Granadina Cusenier 750 Ml;CUSENIER;750.0 ml;Aperitivo;Aperitivo   Granadina;Aperitivo   Granadina   Cusenier;Bebidas sin alcohol (no agua)
7,79E+12;Yerba Mate Campo Amanda 1 Kg;AMANDA;1.0 kg;Yerba;Yerba   Mate;Yerba   Mate   Campo;Yerba mate
7,79E+12;Cerveza Rubia Iguana 970 Cc;IGUANA;970.0 cc;Cerveza;Cerveza   Rubia;Cerveza   Rubia   Iguana;"Bebidas alcoh√≥licas (no bebidas ""blancas"")"
7,79E+12;Cerveza Rubia Stella Artois 970 Cc;STELLA ARTOIS;970.0 cc;Cerveza;Cerveza   Rubia;Cerveza   Rubia   Stella;"Bebidas alcoh√≥licas (no bebidas ""blancas"")"
7,79E+12;Cerveza Rubia Patagonia Amber Lager 740 Cc;PATAGONIA;740.0 cc;Cerveza;Cerveza   Rubia;Cerveza   Rubia   Patagonia;"Bebidas alcoh√≥licas (no bebidas ""blancas"")"
7,79E+12;Cerveza Rubia Cristal Quilmes 1 Lt;QUILMES;1.0 lt;Cerveza;Cerveza   Rubia;Cerveza   Rubia   Cristal;"Bebidas alcoh√≥licas (no bebidas ""blancas"")"
7,79E+12;Cerveza Negra Quilmes Stout 1 Lt;QUILMES;1.0 lt;Cerveza;Cerveza   Negra;Cerveza   Negra   Quilmes;"Bebidas alcoh√≥licas (no bebidas ""blancas"")"
7,79E+12;Cerveza Rubia Bajo Cero Quilmes 1 Lt;QUILMES;1.0 lt;Cerveza;Cerveza   Rubia;Cerveza   Rubia   Bajo;"Bebidas alcoh√≥licas (no bebidas ""blancas"")"
7,79E+12;Cerveza Rubia Chopp Brahma 1 Lt;BRAHMA;1.0 lt;Cerveza;Cerveza   Rubia;Cerveza   Rubia   Chopp;"Bebidas alcoh√≥licas (no bebidas ""blancas"")"
7,79E+12;Cerveza Rubia Quilmes 1890 1 Lt;QUILMES;1.0 lt;Cerveza;Cerveza   Rubia;Cerveza   Rubia   Quilmes;"Bebidas alcoh√≥licas (no bebidas ""blancas"")"
7,79E+12;Cerveza Rubia Quilmes Cristal 340 Cc;QUILMES;330.0 cc;Cerveza;Cerveza   Rubia;Cerveza   Rubia   Quilmes;"Bebidas alcoh√≥licas (no bebidas ""blancas"")"
7,79E+12;Cerveza Rubia en Lata Quilmes 473 Cc 6 Un;QUILMES;473.0 cc;Cerveza;Cerveza   Rubia;Cerveza   Rubia   en;"Bebidas alcoh√≥licas (no bebidas ""blancas"")"
7,79E+12;Agua Mineral sin Gas Eco de Los Andes 500 Cc;ECO DE LOS ANDES;500.0 cc;Agua;Agua   Mineral;Agua   Mineral   sin;Agua
7,79E+12;Agua Mineral sin Gas en Bidon Nestle 6.3 Lt;NESTL…;6.3 lt;Agua;Agua   Mineral;Agua   Mineral   sin;Agua
7,79E+12;Sal con Hierbas en Salero Dos Anclas 200 Gr;DOS ANCLAS;200.0 gr;Sal;Sal   con;Sal   con   Hierbas;Almacen no incluidos en otra categor√≠a
7,79E+12;Sal Gruesa en Estuche Dos Anclas 1 Kg;DOS ANCLAS;1.0 kg;Sal;Sal   Gruesa;Sal   Gruesa   en;Almacen no incluidos en otra categor√≠a
7,79E+12;Sal Fina en Estuche Dos Anclas 500 Gr;DOS ANCLAS;500.0 gr;Sal;Sal   Fina;Sal   Fina   en;Almacen no incluidos en otra categor√≠a
7,79E+12;Sal Fina en Paquete Dos Anclas 500 Gr;DOS ANCLAS;500.0 gr;Sal;Sal   Fina;Sal   Fina   en;Almacen no incluidos en otra categor√≠a
7,79E+12;Sal Gruesa en Paquete Dos Anclas 1 Kg;DOS ANCLAS;1.0 kg;Sal;Sal   Gruesa;Sal   Gruesa   en;Almacen no incluidos en otra categor√≠a
7,79E+12;Oregano Dos Anclas 25 Gr;DOS ANCLAS;25.0 gr;Oregano;Oregano   Dos;Oregano   Dos   Anclas;Almacen no incluidos en otra categor√≠a
7,79E+12;Pimienta Blanca Molida Dos Anclas 25 Gr;DOS ANCLAS;25.0 gr;Pimienta;Pimienta   Blanca;Pimienta   Blanca   Molida;Almacen no incluidos en otra categor√≠a
7,79E+12;Aji Molido Dos Anclas 50 Gr;DOS ANCLAS;50.0 gr;Aji;Aji   Molido;Aji   Molido   Dos;Almacen no incluidos en otra categor√≠a
7,79E+12;Sal Fina Light en Estuche Dos Anclas 500 Gr;DOS ANCLAS;500.0 gr;Sal;Sal   Fina;Sal   Fina   Light;Almacen no incluidos en otra categor√≠a
7,79E+12;Ajo Deshidratado Dos Anclas 25 Gr;DOS ANCLAS;25.0 gr;Ajo;Ajo   Deshidratado;Ajo   Deshidratado   Dos;Almacen no incluidos en otra categor√≠a
7,79E+12;Canela Molida Dos Anclas 30 Gr;DOS ANCLAS;30.0 gr;Canela;Canela   Molida;Canela   Molida   Dos;Almacen no incluidos en otra categor√≠a
7,79E+12;Azucar Impalpable Dos Anclas 250 Gr;DOS ANCLAS;250.0 gr;Azucar;Azucar   Impalpable;Azucar   Impalpable   Dos;Almacen no incluidos en otra categor√≠a
7,79E+12;Agua Mineralizada sin Gas Glaciar 1.5 Lt;GLACIAR;1.5 lt;Agua;Agua   Mineralizada;Agua   Mineralizada   sin;Agua
7,79E+12;Agua Mineralizada sin Gas Glaciar 2 Lt;GLACIAR;2.0 lt;Agua;Agua   Mineralizada;Agua   Mineralizada   sin;Agua
7,79E+12;Crema Dental Interdental Colgate 180 Gr;COLGATE;180.0 gr;Crema;Crema   Dental;Crema   Dental   Interdental;Perfumer√≠a e higiene personal
7,79E+12;Crema Dental Interdental Colgate 90 Gr;COLGATE;90.0 gr;Crema;Crema   Dental;Crema   Dental   Interdental;Perfumer√≠a e higiene personal
7,79E+12;Crema Dental Accion Xtreme Colgate 90 Gr;COLGATE;90.0 gr;Crema;Crema   Dental;Crema   Dental   Accion;Perfumer√≠a e higiene personal
7,79E+12;Crema Dental Accion Xtreme Colgate 180 Gr;COLGATE;180.0 gr;Crema;Crema   Dental;Crema   Dental   Accion;Perfumer√≠a e higiene personal
7,79E+12;Crema Dental Ultra Blanco Colgate 90 Gr;COLGATE;90.0 gr;Crema;Crema   Dental;Crema   Dental   Ultra;Perfumer√≠a e higiene personal
7,79E+12;Crema Dental Brillante Herbal Colgate 90 Gr;COLGATE;90.0 gr;Crema;Crema   Dental;Crema   Dental   Brillante;Perfumer√≠a e higiene personal
7,79E+12;Crema Dental Original Noc 10 50 Gr;NOC 10;50.0 gr;Crema;Crema   Dental;Crema   Dental   Original;Perfumer√≠a e higiene personal
7,79E+12;Cerveza Rubia Retornable Heineken 1 Lt;HEINEKEN;1.0 lt;Cerveza;Cerveza   Rubia;Cerveza   Rubia   Retornable;"Bebidas alcoh√≥licas (no bebidas ""blancas"")"
7,79E+12;Cerveza Rubia Lager Imperial 1 Lt;IMPERIAL;1.0 lt;Cerveza;Cerveza   Rubia;Cerveza   Rubia   Lager;"Bebidas alcoh√≥licas (no bebidas ""blancas"")"
7,79E+12;Cerveza Rubia Retornable Schneider 1 Lt;SCHNEIDER;1.0 lt;Cerveza;Cerveza   Rubia;Cerveza   Rubia   Retornable;"Bebidas alcoh√≥licas (no bebidas ""blancas"")"
7,79E+12;Cerveza Rubia Retornable Budweiser 1 Lt;BUDWEISER;1.0 lt;Cerveza;Cerveza   Rubia;Cerveza   Rubia   Retornable;"Bebidas alcoh√≥licas (no bebidas ""blancas"")"
7,79E+12;Cerveza Rubia en Lata Schneider 473 Cc;SCHNEIDER;473.0 cc;Cerveza;Cerveza   Rubia;Cerveza   Rubia   en;"Bebidas alcoh√≥licas (no bebidas ""blancas"")"
7,79E+12;Cerveza Rubia en Lata Schneider 473 Cc 6 Un;SCHNEIDER;473.0 cc;Cerveza;Cerveza   Rubia;Cerveza   Rubia   en;"Bebidas alcoh√≥licas (no bebidas ""blancas"")"
7,79E+12;Cerveza Rubia Miller Genuine Draft 1 Lt;MILLER;1.0 lt;Cerveza;Cerveza   Rubia;Cerveza   Rubia   Miller;"Bebidas alcoh√≥licas (no bebidas ""blancas"")"
7,79E+12;Quitamanchas Efecto Espuma en Doypack Trenet Oxi 400 Cc;TRENET;400.0 cc;Quitamanchas;Quitamanchas   Efecto;Quitamanchas   Efecto   Espuma;Limpieza del hogar
7,79E+12;Quitamanchas Efecto Espuma en Doypack Trenet Oxi 400 Cc;TRENET;400.0 cc;Quitamanchas;Quitamanchas   Efecto;Quitamanchas   Efecto   Espuma;Limpieza del hogar
7,79E+12;Lavandina Multisuperficies Original Ayudin 1 Lt;AYUDÕN;1.0 lt;Lavandina;Lavandina   Multisuperficies;Lavandina   Multisuperficies   Original;Limpieza del hogar
7,79E+12;Lavandina Multisuperficies Original Ayudin 2 Lt;AYUDÕN;2.0 lt;Lavandina;Lavandina   Multisuperficies;Lavandina   Multisuperficies   Original;Limpieza del hogar
7,79E+12;Lavandina Multisuperficies Lavanda Ayudin 1 Lt;AYUDÕN;1.0 lt;Lavandina;Lavandina   Multisuperficies;Lavandina   Multisuperficies   Lavanda;Limpieza del hogar
7,79E+12;Lavandina Multisuperficies Lavanda Ayudin 2 Lt;AYUDÕN;2.0 lt;Lavandina;Lavandina   Multisuperficies;Lavandina   Multisuperficies   Lavanda;Limpieza del hogar
7,79E+12;Lavandina Pureza Glaciar Ayudin 2 Lt;AYUDÕN;2.0 lt;Lavandina;Lavandina   Pureza;Lavandina   Pureza   Glaciar;Limpieza del hogar
7,79E+12;Prelavado de Coleres Vivos Doypack Ayudin 470 Cc;AYUDÕN;470.0 cc;Prelavado;Prelavado   de;Prelavado   de   Coleres;Limpieza del hogar
7,79E+12;Pastilla Inodoro Canasta Ayudin 16 Gr;AYUDÕN;16.0 gr;Pastilla;Pastilla   Inodoro;Pastilla   Inodoro   Canasta;Limpieza del hogar
7,79E+12;Tomate Pelado Perita en Lata La Campagnola 400 Gr;LA CAMPAGNOLA;400.0 gr;Tomate;Tomate   Pelado;Tomate   Pelado   Perita;Almacen no incluidos en otra categor√≠a
7,79E+12;Pure de Tomate Tetrabrik Salsati La Campagnola 520 Gr;LA CAMPAGNOLA;520.0 gr;Pure;Pure   de;Pure   de   Tomate;Almacen no incluidos en otra categor√≠a
7,79E+12;Mayonesa Light Doypack BC La Campagnola 500 Gr;BC;475.0 gr;Mayonesa;Mayonesa   Light;Mayonesa   Light   Doypack;Almacen no incluidos en otra categor√≠a
7,79E+12;Mermelada de Durazno Frasco La Campagnola 454 Gr;LA CAMPAGNOLA;454.0 gr;Mermelada;Mermelada   de;Mermelada   de   Durazno;Almacen no incluidos en otra categor√≠a
7,79E+12;Mermelada de Frutilla La Campagnola 454 Gr;LA CAMPAGNOLA;454.0 gr;Mermelada;Mermelada   de;Mermelada   de   Frutilla;Almacen no incluidos en otra categor√≠a
7,79E+12;Mermelada de Ciruela Frasco La Campagnola 454 Gr;LA CAMPAGNOLA;454.0 gr;Mermelada;Mermelada   de;Mermelada   de   Ciruela;Almacen no incluidos en otra categor√≠a
